{
 "logicalStructures": [{
  "endPagePosition": 1,
  "startPageLabel": "1",
  "startPageID": "PHYS-1",
  "descriptiveMetadataID": "ITEM-1",
  "label": "Hospital. Cambridge, Addenbrookes , Cambs, UK",
  "startPagePosition": 1,
  "endPageLabel": "1"
 }],
 "pages": [{
  "displayImageURL": "/content/images/PH-GEOGRAPHY-35KAB-00034-000-00001.dzi",
  "imageWidth": 7235,
  "sequence": 1,
  "thumbnailImageURL": "/content/images/PH-GEOGRAPHY-35KAB-00034-000-00001_files/8/0_0.jpg",
  "IIIFImageURL": "PH-GEOGRAPHY-35KAB-00034-000-00001.jp2",
  "downloadImageURL": "/content/images/PH-GEOGRAPHY-35KAB-00034-000-00001.jpg",
  "label": "1",
  "physID": "PHYS-1",
  "thumbnailImageOrientation": "landscape",
  "imageHeight": 4701
 }],
 "numberOfPages": 1,
 "descriptiveMetadata": [{
  "extent": {
   "display": true,
   "label": "Extent",
   "displayForm": "1 photograph",
   "seq": 171
  },
  "physicalLocation": {
   "display": true,
   "label": "Physical Location",
   "displayForm": "Cambridge University Collection of Aerial Photography",
   "seq": 4
  },
  "notes": {
   "display": true,
   "label": "Note(s)",
   "value": [{
    "display": true,
    "displayForm": "For full record see <a target='_blank' class='externalLink' href='https://www.cambridgeairphotos.com/location/35kab034/'>https://www.cambridgeairphotos.com/location/35kab034/<\/a>",
    "seq": 163
   }],
   "seq": 162
  },
  "thumbnailOrientation": "landscape",
  "shelfLocator": {
   "display": true,
   "label": "Classmark",
   "displayForm": "35kAB034",
   "seq": 5
  },
  "subjects": {
   "display": true,
   "listDisplay": "inline",
   "label": "Subject(s)",
   "value": [{
    "display": true,
    "linktype": "keyword search",
    "fullForm": "Aerial photography",
    "displayForm": "Aerial photography",
    "seq": 21
   }],
   "seq": 20
  },
  "displayImageRights": "Zooming image copyright Cambridge University Collection of Aerial Photography",
  "metadataRights": "This metadata is licensed under a Creative Commons Attribution-NonCommercial-NoDerivs 3.0 Unported License.",
  "imageReproPageURL": "https://www.cambridgeairphotos.com/",
  "title": {
   "display": false,
   "label": "Title",
   "displayForm": "Hospital. Cambridge, Addenbrookes , Cambs, UK",
   "seq": 8
  },
  "fundings": {
   "display": true,
   "label": "Funding",
   "value": [{
    "display": true,
    "displayForm": "",
    "seq": 201
   }],
   "seq": 200
  },
  "docAuthority": "",
  "creations": {
   "display": true,
   "value": [{
    "places": {
     "display": true,
     "label": "Origin Place",
     "value": [{
      "display": true,
      "linktype": "keyword search",
      "shortForm": "52.175613 0.141032",
      "displayForm": "52.175613 0.141032",
      "seq": 69
     }],
     "seq": 68
    },
    "dateDisplay": {
     "display": true,
     "linktype": "keyword search",
     "label": "Date of Creation",
     "displayForm": "21/10/1970",
     "seq": 77
    },
    "dateStart": "1970",
    "dateEnd": "1970",
    "type": "creation"
   }],
   "seq": 63
  },
  "ID": "ITEM-1",
  "downloadImageRights": "Images made available for download are licensed under a Creative Commons Attribution-NonCommercial 3.0 Unported License (CC BY-NC 3.0)",
  "thumbnailUrl": "/content/images/PH-GEOGRAPHY-35KAB-00034-000-00001_files/8/0_0.jpg"
 }],
 "sourceData": "/v1/metadata/tei/PH-GEOGRAPHY-35KAB-00034/",
 "embeddable": true
}